review_text,stars
"Overall, the hotel was moderately clean and the staff were professional and kind. However, there were several issues that made the stay frustrating. There were only two elevators in the entire hotel for both guests and staff, which caused long delays. We stayed on the 15th floor and ended up walking down all 15 flights of stairs with our luggage so we wouldn’t miss our flight. We called the elevator three times, and each time the wait was at least 5 to 10 minutes, and the elevators were completely full. While the hotel was affordable, I would not stay here again. The room temperature was also very uncomfortable, constantly switching between unbearably hot and unbearably cold.",2
The airbnb host Quinn was always responsive and gave answers to my question. Jessica at the front desk went above & beyond giving directions and suggestions. The door person found a taxi cheaper than Lyft getting there. Wonderful place to stay!,5
"Dirty rugs, noisy place, mirrors disfigured, bed linens with black lint throughout, safe didn't work (wouldn't lock), no cookies at 3 pm - 5pm as promised, dirty elevators. TV not programed with time nor date. The owners need to remodel, do upgrades. I know this is a busy Hampton Inn due to the location of Times Square, but you can do remodeling floor by floor until completed. Only lose a few bucks spread out over time and happier guests. I've owned 2 businesses and this is not the ideal way to satisfy a guest/client. I will never stay here again; not up to my cleanliness standards. Highlights: The breakfast guy is helpful and cheery housekeeping did an great job. Check in & out easy.",3
"The stay was pleasant. The elevator wasn't working on Saturday morning, but they had a technician who was on site and operated it manually so we could get to our appointment without delay.",4
"such a great hotel that’s close to ALL of the touristy things! Times Square, Central Park, Liberty Bagels, and just a short Subway ride from the financial district. Easy to navigate and off in a slightly more slow street which was nice for sleeping at night.",5
"It was all about convenience for me and needed to be in the center of attractions and this place nailed the spot. I was very satisfied. The rooms were clean. Staff was friendly. Breakfast was, just OK. But overall, my trip was a success.",5
"As someone who has never been to New York City before, I thought it was easy to find, it was clean, and it was close to everything to we could walk. Staff was also very friendly",5
"As a solo female traveller I felt safe and accommodated. Staff was friendly and helpful. It is mid-town so do not expect a big hotel but everything was clean, bed was comfortable and the buffet was perfect!",5
"Loved this stay. I normally prefer apts. and less hotels. But in this case, the room was great. The Location was great. Free breakfast every day and 27/4 tea and coffee stations which was perfect for me as I caught a cold! Such good value for money. A big LIKE.",5
"This place was fine. And that what I would call it. Good location, nice staff, the place is mostly clean.(dirty under the mattress but the sheets were clean which is what counts) But it is a cheaper place to stay. So you pay for what you get. It gets the job done.",4
"Place is as described. Rooms are small but clean. Location is great. Right in the middle of Times Square and walkable to most places. Elevator wait times is a real problem. But if you are patient and ignore that, it’s not too bad. Breakfast is okay.",4
The hotel is close to everything that you would want. -time square -restaurants -shopping -subway stations Just make sure you prepare some place to park before you go. Room was comfy and was cleaned daily. If you are looking for views this is not the place,5
This was a perfect place to stay in Midtown. The property was off the strip so we didn’t hear any noise. The area was very safe and a 20 minute walk to everything. The hosts checked in with me to make sure our stay was going well. Would definitely stay here again. Thank you.,5
"A nice place to stay if you are just looking for somewhere to rest and get ready at. Pretty small but it worked for our weekend. We were able to check-in early without requesting an early check-in and staff were nice. Elevators took a long time and had broken lights. The room was fine including a king size bed and mini fridge. The water in the shower backed up and the floor was a little dirty. Walking distance to Hell's Kitchen, Theater District, Time Square, and more. The street itself was a little run down but easy to get to other parts of the city.",4
"⭐️⭐️⭐️⭐️⭐️ 5/5 — Perfect Manhattan Stay! Our stay at this Airbnb in New York City was absolutely amazing! The apartment was spotless — super clean, modern, and comfortable. The location couldn’t have been better — right in Manhattan and walking distance to so many great restaurants, shops, and attractions. It was incredibly convenient for exploring the city, and everything we needed was close by. Check-in was smooth, and the host was friendly and responsive. We couldn’t have asked for a better place to stay — definitely recommend it to anyone visiting New York!",5
"For my first visit to NYC, the location of the room was perfect. It was close to a subway and I was able to walk to Broadway for two shows, Times Square, and Macy’s. A little further walk to Central Park. I was able to get sound sleep with the room being quiet and with a comfortable and clean bed.",5
"Because I had booked two separate rooms, and used my name on both, the desk could not locate the second room upon arrival in their system. Instead of a hassle, the clerk person found the glitch between AirBnB and their system, and rectified everything efficiently and swiftly. Throughout our two-day stay, we found the personnel to be exceptionally friendly and helpful with bags and information. The location, near 39th and 9th Avenue, was just right for our needs. Thanks for making our stay pleasant.",5
"Although small the hotel Is in a great location, the staff was friendly and attentive! The only issue I had was that our room was close by the elevator and we heard all the noise. Otherwise it was clean and close to all the NYC attractions! We’d defiantly book again.",4
"The staff here were great, the room was nice, the location was great. Only thing we didn’t like was the curtain in our room didn’t fully close. From out side looking up at our room, it appeared there were only a few rooms that had our issue possibly. The curtain mount itself didn’t allow for it to close and the apartments directly across from us could see right in. Also the only ice machine that worked was in the basement. Other than that we enjoyed our stay.",4
"I had a terrible experience. The rooms smelled bad, the towels were extremely foul-smelling to the point that it was disgusting to dry myself with them, and my sheets had yellow stains and even blood — yes, blood. This is absolutely unacceptable! On top of that, at check-in I was told there would be a $150 fee held until check-out and that it would be refunded instantly. However, when I checked out, I was informed that it actually takes five business days for the money to be returned. This is nothing but lies and complete disregard for the guest.",1
"This was a great hotel for a solo female traveler. The location was great for getting to lots of areas - Chelsea, upper east & west side, plus the theater district. Lots to do and really nice staff. Would definitely recommend!",5
"We enjoyed our stay at this hotel! The location is super convenient, and this is a great value stay for such an expensive area generally. We would stay here again for sure.",4
"I enjoyed my stay at Times Square South, the room was nice and breakfast was great too, but there’re some minor things like it doesn’t have new furniture, it might be old or a bit dirty. But in general it was a good experience.",4
Everything went very smoothly with check-in. The interface between the hotel and AirBnB was seamless. The front desk staff were welcoming and friendly. The room itself was adequate for our needs. The hotel felt safe. I would stay here again.,4
"This location is poorly maintained. The elevators are super small and the entire lobby area is in need of maintenance and cleaning. The room was ok, but the vents on the AC unit were cloggy and the carpets were gross!",3
It’s the Hampton Inn and booking through Airbnb was a lot cheaper than booking through Hilton. Great location for me as I took the bus to Manhattan and the hotel is 3 min walk from Port Authority Bus Terminal. It's also very close to Times Square.,5
After waiting to get checked in we missed our tour and it was my birthday so it was ruined. The host took a while to respond while dealing with this. There were people everywhere waiting on their room to be cleaned. Once we got our room the mirror had some kind of symbols written on them and they never came to clean it or remove it. The shower floor was missing and hard to stand on. Host was bad and hotel was as well. Now the location is the only thing that was good about it all.,1
We were on a two day mother/son trip to New York. We saw four shows and walked to Central Park and Times Square. Our stay was exactly what we needed. The hotel was clean and safe and the location could not have been better. We easily walked from the train station to the hotel to drop our bags. The staff were amazing. They were very nice and helpful and kept our bags before we checked in and after we checked out so we did not have to try to drag them through theatres. It was just a great stay. Thank you!,5
"This place was very clean & quiet, nice stay for a couple of days, Times Square just a few blocks away walking distance! Served free breakfast which was a plus! Only thing I wish os that it had some sort of bluetooth or fire stick/cable for TV.. Other than that, i’d book again!",4
"Very happy with our short stay here. Great location, easily walkable to Broadway shows, etc. We arrived early and were able to check in upon arrival. Front desk attendant was very welcoming! Rooms were clean and comfy.",5
"It is hard to find a better value for money in New York, with hosts who reply in under 10 minutes. The place is clean and spacious, check-in and check-out were smooth, and it’s definitely a convenient choice for a budget-friendly stay in NYC even though the rooms are elegant.",5
"Location, location, location! This was perfect for our extra night we decided to spend in NYC. Close to Times Square and close to the subway. The room was perfect for just my husband and I. We could see the top of the Empire State Building from our room. Would definitely stay here again.",5
Great place to stay! The hotel was decent for NYC in size and clean! The view was great!!! The elevators do take a long time sometimes but that is sometimes to be expected. Definitely would book again (:,5
I was a little bit worried when I saw the reviews about the cleanliness since I am a germaphobe myself but it was spotless. The front desk was super welcoming and polite. The location was perfect and the room was really cozy.,5
"my husband and I planned a one night getaway to NY City. where we stayed was perfect as we could walk pretty much anywhere we wanted to go. It was clean, quiet, and comfortable. we couldn't have asked for more! Thankyou!",5
"I didn't actually get to stay at this hotel. When I arrived, they said they had no rooms and took me to a hostel two doors down. The service was excellent, but then the new hostel overcharged my credit card without informing me. I asked the front desk about it after I noticed that I was being charged for extra cost, and they said it was a mistake and they would refund the money. But I still feel bad.",3
The room was perfect with in suite bathroom & full length mirror. Very walkable to public transit. Generous complimentary breakfast as this room is located inside a Hampton by Hilton. Only Two elevators to service 32 floors. Wait times are long during morning breakfast and check out.,5
"11 years on Airbnb Rating, 5 stars , · August 2025 Lovely comfortable and well presented room. The provision of coffee and biscuits at the check-in were a surprise bonus. The accommodation was very handy to all the main New York attractions- very walkable. I would recommend the hotel for a visit.",5
Definitely worth it! Great location + great amenities! Comes with free breakfast which is good for the price! Employees were very friendly and very helpful. Highly recommend! Definitely coming back! ☺️☺️,5
"10 years on Airbnb Rating, 5 stars , · August 2025 Easy walk from Pen Station to this Airbnb. Great location and very quiet which is a surprise for New York City. I enjoyed the late checkout and that I can leave my bags there after checkout. Comfy bed and no issues at all. Would highly recommend for anyone staying in NYC",5
"My stay was delightful. Everything was clean, staff was friendly, and the location was perfect for walking.",5
A very comfortable place to stay near Times Square! The room was clean and service was amazing!,5
"This was an extra night we had to do, so we had to schedule the extra night through here, but here is the review again: Location was perfect! You are just a block away from the street that will take you directly to times square, also you have one of the main subway stations just a couple of blocks away and everything seems super close. Staff is superfriendly on main desk, on breakfast, cleaning; all of them were super helpful and great; We had to stay an extra night due to a winter storm and they were super helpful to make sure we didn't have any extra inconvenience. Internet is not that great but I managed to have some calls and work a bit from the hotel. Only real drawback we really had was about the elevators. One broke down on the second day so you have to wait a long time to go either up or down during peak hours, and it wasn't fixed in the full 7 extra days we stayed there.",5
"Had a great stay at this location. central for all that NYC has to offer and short walk from times square. Beds are very comfy and rooms are clean and cozy, but the place is very dated. Not worth the price we paid. I have to say that although the guy at breakfast was really nice and cheerful, the breakfast experience was not the best. We were unable to have breakfast on 2 of the days, due to there being to many people and not enough seating. people were taking there food to the rooms if and when they could get to the food. The lifts were broken throughout our stay, with only one lift working. My family had to drag their cases down 7 flights of stairs when we were checking out as the lift that was working was full for over 1 hour so difficult to get in with the amount of people using them. it was stressful. People corrugated outside the lift and the space was only wide enough for one person, made it difficult to assess. Staff were lovely, friendly and professional. made to feel welcome.",3
Great stay. Easy check in and walkable distance to Times Square. We just needed a place to sleep and shower and this was perfect.,5
Very nice 3 star hotel. The staff were friendly and super responsive to the couple of issues that we had. The location is excellent. Great value for the price!,5
"Great location, hotel room clean and comfy bed. We had a great stay and would definitely return when next in New York, many thanks",5
"Good hotel for the price! 10 mins from Time Square, lots of good food options, 10 minutes from the Manhattan Center!",4
"While I was very stressed out over the hotel not having our correct reservation due to rebooking issues (I was reassured after my partner informed me people could own hotel rooms in New York 😅), eventually the reservation was put in place successfully and we were able to check in with no problem. Traveling can be really stressful and the hosts were communicative and helpful, especially when I was very stressed over our booking. The location is in a wonderful area, reasonable distance between all sight seeing and nearby transportations. There’s a 20.00 shuttle from the airport to a ten minute walk from the hotel. Thank you to the hosts for their patience and ensuring my reservation was in placed through my travel panic, the stay once the reservation was in place was smooth and wonderful!",5
"Great place and super affordable for the area, you are in walking distance of most things and if you’re not the subway is down the street",5
Great stay! Super convenient to Times Square. Everything was as described. No issues at all. Would definitely stay here again.,5
"Nice location, small but cozy room, friendly and helpful staff, I would have given a 5-star review if it were not for what we experienced during the first night. During the stay of our first night, the heating system in the room did not work. The room was too cold to fall asleep in NYC's freezing December. At around 5:00 a.m., I went to the front desk and reported the issue. Later, an engineer confirmed that the heat had broken. We were then transferred to another room. After the transfer, I noticed that there was a clearly installed control panel on the wall for the heating system, while there were only exposed screws at the same place in the previous room. This indicated that the hotel should have already known the failure of the amenity, but they still assigned the room to me. I requested a refund for the first night. So far, the hotel hasn't responded, even after the intervention of Airbnb. Anyway, this might be a good place most of the time, but be aware of the risk.",2
"This was a great location. The room was nice and spacious. Elevator took a long time so try getting rooms on the lower floor. But, overall a really great location.",4
Nice place. Off the busy section so not too much noise. Easy to walk to everything we wanted to see.,5
"Great location, and solid amenities for the price. Room was clean and as advertised. Would stay here again!",5
The host at the hotel was awesome she helped a lot with parking as well. Also Cesar who served breakfast in the am was amazing and u can tell he loves his job.,4
"The hotel was amazing! A 10 minute walk to Times Square, and super close to other attractions too! The room was spacious and super clean. Highly recommend!",5
"The room was clean, the beds were comfortable, the staff was helpful! Good price for the location.",5
"Great hotel, great and friendly staff, kind and responsive host. The hotel and location was well worth the money for the NYC/times square experience. Host was very responsive and kind for any questions or concerns. The hotel was clean, nice and the staff was great. Breakfast was just a typical hotel breakfast with amazing waffles with any toppings you’d like, the hotel staff even made the waffles for us and wrapped it up for us when we wanted to take them up and eat in the room but there was plenty of room in the dining areas to eat as well. As read in other reviews the elevator could be slow at times during breakfast rush, or check in times, but other than that I hardly waited for an elevator and most of the time rode it completely by myself with nobody else inside even during Christmas time. Everything went amazingly and I 10000% recommend this location and host. Thank you so much again! And we will be back for our next trip to Times Square :)",5
"It was exactly as expected. Generally clean hotel room with a king bed, bathroom and mini fridge. We stayed during the Christmas holidays. The staff were very friendly and helpful. They held our bags before check in and after check out so we could walk around without them. The elevators were working perfectly fine despite negative reviews about them. Location is great, on a non busy street but still a 5 min walk to times Square, Bryant Park etc. Was it small? Sure but its a hotel room in NYC I'm not sure why people are expecting spacious - and you aren't there to hang out in the room. Its perfect for changing, sleeping, showering etc. Exactly what you need it for. Only qualm was the toilet was kind of broken. The handle wasnt really working and you had to push down REALLY hard to flush. But I'm sure they will fix that. Also, it isn't fancy by any means and is slightly dated but that doesn't bother us. But I know it does for some people. We would stay again!",4
"It was a beautiful place to stay, small, quiet, friendly and within walking distance of Times Square and many other restaurants and places",5
Perfect location close to all subways and quiet but still near Times Square. Bed was comfy and free breakfast was amazing and everyone was super friendly,5
"Great hotel, good location, comfy bed, nice workers. Only complaint is it’s about a 20 minute wait for an elevator in the morning",4
The location was excellent but the price was a lot (I guess nyc prices but still) for a very basic hotel. Breakfast was also very limited.,3
"Great location, very friendly staff, close to all the perfect restaurants and sights to see. Will be staying here again next time i’m in NYC!",5
Good location in garment district. Walkable to most places you want to be during holidays.,4
"We loved staying here! The staff were nice and helpful, great breakfast, great location, and very clean! Would stay again!",5
"Great location, the staff was friendly and all needs meet. Enjoyed the waffles for breakfast 😋 Would definitely stay again",5
The room was great The hotel was great location especially everything for the price we received The staff was amazing It was perfect for a mother-daughter trip,5
Great location and they held my luggage since we got there early. Staff was very nice and room was clean. My only complaint would be the elevators were very slow.,4
Communication was great throughout. The front desk was very helpful in printing a few documents needed for a business presentation. All staff members were very friendly.,5
"Everything was as described, and super close to Times Square. Plenty of different eating places to go to, within 20 minutes of walking.",5
"Facilites are great, very convenient, very close to the heart of Manhattan, accesible to public transportation and breakfast included makes a difference",5
The location was ideal and the space was all we needed. Highly recommend for anyone interested in the attractions midtown NYC has to offer!,5
I enjoyed my Stay. The area was very nice and busy lots of places to eat and being able to see the city was amazing.,5
"The hotel met my expectations. I had no issues with check-in. The elevator was quite busy during peak hours, but fortunately, I was on the 4th floor and could often take the stairs. The hallways were somewhat dirty, but the room itself was clean. The neighborhood felt a little sketchy at night, and they lock the doors at 11 PM; however, you can still get in with a keycard. Booking through Airbnb means you won’t earn hotel rewards points, but it still counts as a stay. Overall, I was happy with my stay. I didn’t reach out to the host, but they appeared to be readily available if needed. I would stay here again and book with this host in the future.",5
"The staff is very friendly, helpful and responsive. The hotel needs an upgrade. The bed was not that comfortable, the carpet needs a really good shampooing or better yet to be replaced. We didn't want to walk on it with our bare feet. The lock on the safe in our room didn't work. The stairs, which we used a lot, seem to be missing from their cleaning list. The lobby needs an upgrade. The breakfast is extensive with juices, eggs, all types of breads, muffins, pancakes, oatmeal and more. The location is fabulous, easy access to subways and main transfer stations. It's a very active hotel with lots of groups coming and going which was not an issue for us, yet might be an issue for others as the lobby has a tiny footprint.",3
"We had a good stay at this hotel. Check-in and check-out were quick and easy, and the staff were friendly and attentive throughout our visit. When we arrived, they let us leave our luggage at the front desk before check-in, and our room was ready a couple of hours early, which we really appreciated. The room had a fair amount of space and while the building is a bit older and the showers were small, it didn’t take away from our stay. Our refrigerator wasn’t very cold, and when we asked the front desk if they could store our cheesecake for us, they gladly did. Overall, everything went smoothly and the staff made sure we were taken care of.",5
This place was fantastic. Perfect area for travellers and such a fantastic room. Wish I had booked them for my second leg! Definitely got spoiled when I saw my next Airbnb was like.,5
"I had a wonderful stay at the Hampton Inn Times Square! The location couldn’t be better—just steps away from Broadway, restaurants, and all the action of the city, yet the hotel itself was quiet and comfortable. The staff was friendly, professional, and always willing to help with directions or recommendations. The room was very cozy, smaller than expected. The complimentary breakfast was a nice bonus and saved me time before heading out for the day. Check-in/check-out was smooth and hassle-free. Overall, this hotel is a great choice for anyone visiting New York and wanting convenience, comfort, and great service.",5
