review_text,stars
"Jay was very accommodating when it came to our late check in. I did not get a chance to meet him, but he was very responsive. Free street parking was a bonus.",5
"I was very happy with the communication with Jay. The apartment was clean and cozy. Safe area, good access to public transport. I'd love to come back. Translated from German Show original",5
"Everything was as described. Jay is very friendly and responds quickly. The accommodation was great, I felt totally comfortable. The surroundings are also great. The subway is right around the corner and you can get everywhere by train. On my next vacation to New York, I will book this place again :-) Translated from German Show original",5
"Overall a good stay. Our room was clean and tidy, the bed was comfortable. It was a very convenient location as well as a safe area. Everything we needed was within walking distance, but it is also a very busy area so you can hear a lot of traffic and conversations from the window. Only negatives was having to share one bathroom between 2 other couples, and also one towel between two of us. Jay was a friendly host.",4
"Happy with our stay! Communication was great, flexible and easy. The place matches the description very well; you share bathroom and kitchen with other guests in a normal, residential building. The area is safe and calm. New York is in general expensive and taking that into account, the price matches what you get.",5
"Very walkable to public transpo - great views just a few minutes walk too! Even though the bathroom was shared, it still felt very private and peaceful. I had a lot of questions when I checked in and Luz was able to answer all of them with easy recommendations! 10/10 stay would definitely stay here again if I need to come back to NJ/NYC!",5
"The place was clean and comfortable, and Luz was super nice, respectful, and welcoming. The room was as advertised so I had no problems at all. The location had a beautiful view of the city, almost magical. I will definitely book again with her.",5
"I had a great stay here during my NYC trip. The room was clean, quiet, and exactly as described, making it a comfortable place to relax after long days of exploring the city. The check-in process was smooth, and the instructions provided were clear and easy to follow. The North Bergen location worked well as a home base, with convenient access to Manhattan via public transit. I also appreciated how peaceful the neighborhood was, which made it easy to rest and recharge. Overall, this was a pleasant and comfortable stay, and I’m grateful for the hospitality.",5
"I had a good experience at this Airbnb! The place was top notch in terms of quality, and the host was incredibly friendly and welcoming, always responsive and helpful. Everything was straightforward and easy to understand, which made my stay stress free. It's perfect for solo travelers, and the convenience of being so close to New York City is a huge plus just a quick trip down including the bus stop not even being a 2 minute walk from the stay. I thoroughly enjoyed my time there and would definitely book again. Highly recommended (:",5
"Pittsburgh, Pennsylvania Rating, 4 stars , · October 2025 Very convenient to NYC. The room and bathroom were very clean. I rented this room since ‘dedicated bathroom’ was noted on the listing but then it was also described as ‘shared bathroom’ in the details paragraph which I did not read carefully. Like another reviewer said, I was under the impression this was one of two bedrooms in a house, and not one of several. That said, when I was there it was quiet and without lots of other renters and I did not have trouble accessing the bathroom when I needed it.",4
"The room was clean, and good if you are just there to sleep and not spend much time. I didn't realize it would be a boarding house before staying. It was a little inconvenient sharing a bathroom with 5-6 other people. The bathroom also had some noticeable mold near the ceiling from a previous water leak which I am highly allergic to, but did not complain as it wouldn't have been fixed in the short time I stayed there. Pack light if staying here because the stairs to get up to your room are made for tiny people with no luggage. Overall it was fine and an alright stay for the price.",4
"Very easy to get in and out of NYC via bus. Luz is very friendly and replies fast. The apartment is very clean and you enter via code locks. There are two shared bathrooms for around 8 rooms, but they were almost never occupied when I wanted to use them.",5
30min with the bus to Times Square. I like the location and the price. l also like that you could come and go whenever you wanted.,5
Lovely stay at Luz’s place - very well connected with a 25 minute bus into NYC a minute’s walk away. Would definitely stay again!,5
"Great place, only 30 mins away from Times Square by bus. Luz is an amazing host who always responded to my messages in no time at all. Definitely recommended!",5
I spent 10 days in NYC and the room was perfect ! I will definitely recommend this place to someone alone who would visit NYC ! Everything was perfect and clean ! Instructions were clear and Luz was so ractive ! I would recommend!!,5
This was a wonderful stay! The room was delightful and location was very convenient to catch buses to NYC. I also appreciated how communicative Luz was and how clear all their instructions were. Will definitely be back if I'm in the area!,5
"Luz and family were very welcoming, kind and exceptional hosts! The unit is well maintained and clean. The house is located in a peaceful location of NJ across the street from the park, river and buses that leads you straight into NYC. We highly recommend and would book again. For anyone with a physical disability or finds tight spaces and stairs challenging, note that the home is a typical Victorian architecture. There's 2 thin, winding triangle staircases leading to the bedroom.",5
"Nice host very friendly and quick respond ,location with amazing close to NYC and skyline view was beautiful I will book it again and will recommend it to my friends while visiting new jersey.",5
"A great stay. Perfect for the folks on solo trips. Easy to find & a nice walking distance from park, coffee shops & bus stops. Easy commute in and out of the city. Need somewhere to just rest your head, this is perfect.",5
Great location - right off the bus route.,5
"- Excellent host communication - Responded to all of my questions prior to arriving - Good location - Easy to find - Neighborhood is pleasant - Very short walk to bus stop and city skyline view - Great stay - Clean, spacious room - External noise was minimal - Felt safe leaving my belongings - Bathroom is shared but very clean and good shower - Option to do laundry is convenient If you're visiting NYC, the NJ Transit bus gets you to Port Authority Bus Terminal in about 20 minutes, where you can connect to the MTA. It’s easier than it sounds and works out well. Overall, I’d gladly stay here again. Thank you!",5
easy to find and Luz response so quickly when I contact,5
"Luz was a very nice and helpful host, she was proactive to speak for help and recommendations. The location was perfect to get to Manhattan. The bus stop is 3 minutes' walk from home, which is why the way was also pleasant. My room was as described in the ad and clean. I had a very nice stay at Luz's place. Translated from German Show original",5
"Wonderful room, spacious and comfortable.",5
Thank you for the easy stay Luz! Much appreciated how well the communication was. Very easy and the room was tidy.,5
"11 years on Airbnb Rating, 5 stars , · April 2025 Luz was good host, responded to messages promptly, even with different time differences. Place was easy to find bus stop nearby. The room was very spacious. Had access to coffee machine and water which was great. A microwave would have been handy to have access to as there’s no access to a kitchen in this listing. Place has a dryer and washing machine in basement for extra cost of $10. Detergent provided. 👍🏽 Shared bathrooms are kept very clean. Good place to start my New York trip. Loved the door security/entrance features to the house and the bedroom. If you have a large suitcase be prepared to get creative taking it up and down the rather narrow staircase. So pleased I’ve been learning to lift weights. 😄 Would recommend this place to NJ bound travelers.",5
"awesome, affordable spot. nothing fancy but very clean and easy to get to.",5
"1 year on Airbnb Rating, 5 stars , · March 2025 I had a lovely stay in this cozy, clean, private room. Feels like a home away from home.",5
"my friend and I really enjoyed our stay. We went during the coldest weekend, but the room had a heater so it was all good! The restrooms were close by and even though shared, they were maintained cleaned. The only downside was that we had to climb 3 flights of stairs to get to our room, but staff were willing to help us with our bags when checking in and out :)",4
"8 years on Airbnb Rating, 4 stars , · 2 weeks ago I was surprised at how nice the apartment was maintained. There was a lot of breakfast food provided in the kitchen, which was also unexpected. Alex was very responsive throughout my stay. I would definitely stay here again for my next trip to New York. The rooms close to the entrance can get quite loud in the morning, so I suggest bringing a pair of earplugs !",4
Host was very accommodating and kind! It made our trip so much more enjoyable. The host was very responsive and didn’t miss a chance in letting us know we could always reach out to them at anytime for anything we needed! Rooms were small But comfortable and there’s a lot of great places around with access to the metro just around the corner. Great place overall!,5
"The location of the accommodation was excellent, our room was clean and surprisingly spacious. The kitchen was always fully equipped, so we could enjoy a hearty breakfast before heading out. The bathrooms looked like they were cleaned several times a day because they were always spotless. The host and the staff were extremely kind and friendly, if I ever return to New York, I would definitely stay here again! 🙂",5
Dope spot. They let you drop your stuff before check in. Cameras around the place so in case of anything so you don’t have to worry. Everyone was nice and easy to work with. When we got in Alex showed us around gave us the rules and gave us a key to go in and out when we needed. And the room was spotless and bathrooms were very nice. All in all very simple very mindful very demure.,5
"I volunteered during my stay, and it was a truly wonderful experience. Das, Goku and Ottie and the rest of the staff created a warm, compassionate, hospitable environment, and being part of their outreach made the stay especially meaningful. The space was clean, well-run, and centrally located. And the warm scones in the morning…OMG absolutely delicious! I’m grateful for the opportunity to give back and would happily stay here again.",5
"Stayed here for 3 nights and it was so enjoyable! We were planning on just dropping our bags off early and were able to get an early check in. Everything looked and smelled very clean! The shared bathroom is definitely small, but very clean. The hosts were great and very helpful, especially with carrying up our bags to the 4th floor. Would definitely stay here again!",5
"The location of the place was very ideal for me and it was fairly cheap compared to the rest of the places in the Chelsea area. If you are looking for a place that isn’t expensive but still has all of the basic things you may need, I could definitely recommend this place. Also the hosts are extremely responsive.",4
"This is a great value and in an amazing location (convenient to Penn Stations, subways, restaurants, art museums, galleries). The staff is always friendly and helpful and very considerate. This is my favorite spot to stay when visiting NYC.",5
The Interfaith is a gem of a place. I felt right at home. I loved the community kitchen and appreciated the ability to speak with whoever was working at the front desk. All of the staff was extremely kind and receptive. You can feel that their mission of being a proactive member of the community is authentic. The location made this place a wonderful place to stay. You could spend your entire time in Manhattan walking or taking the train from this great location. Plenty of public transportation and cool things to do and see nearby. I 10 out of 10 recommend. I'll be back soon.,5
"This place is wonderful! Although it has a hostel-style setup, it was exceptionally clean, and the room was both comfortable and cozy. The friendly atmosphere and beautiful and peaceful energy made me feel right at home. Definitely coming back.",5
"Fantastic location, and super kind hosts. We arrived and were immediately welcomed, and the atmosphere felt peaceful and comforting. Thank you so much for such a great stay.",5
"I had a wonderful 5-night stay here at Interfaith and I would 100% book with them again! Everyone was beyond friendly and helpful. The room was the right fit for me as a solo traveler, just enough space and the surrounding area/neighborhood was super calm at night. More so, I loved that everyone at Interfaith was so accepting of people from all walks of life and backgrounds. I also truly enjoyed helping them in their mission to spread love in their community and beyond to feed the homeless 3x a week. Unforgettable experience!",5
"4 years on Airbnb Rating, 5 stars , · January 2026 Totally worth every dollar spent, the friendliness and cleanliness was cherry on top i dont think one will find a better place than this in manhattan at this kind of price. Everyone was very helpful. The train station was 5 - 8 mins walk away. Will visit again for sure!",5
"Wonderful place to stay. The host was kind enough to let me check in early, staff is really friendly, felt very clean, public areas were cleaned frequently, cozy space, location is great. You can really feel that the host cares about your experience here and was really thoughtful about everything. The only negative would be that the bed length is a bit short if you’re tall and it could get a little noisy outside (inside was fine), but I would still stay here again for sure.",5
"Where can I even start I fell right at home. Gokul hope saying it right was super friendly as soon as I arrived helped w all my questions. Check In was amazing they offered me breakfast & everything that’s In kitchen for everyone to grab. Loved all the organic jelly’s, bread , milk and everything that was in the fridge for our use. Russ was very nice and friendly helped me with directions and I volunteer passing out food to homeless was amazing being able to do something good for others. Bathrooms were always clean & room was nice and cozy. I will definitely come back and stay here again",5
"Expensive for what you get. Very small room with shared bathroom. Nicely decorated. Some details are included in the listing such as no meat in the community fridge but after booking, the hosts request no alcohol and a sober building.",4
We immediately felt welcomed on our arrival and had a very pleasant stay! Alex was quick to respond to messages and helpful which was very appreciated. We found everything to be exceptionally clean and exactly like it was described. We would definitely stay here again on our next trip to the city!,5
"3 years on Airbnb Rating, 5 stars , · December 2025 I really loved the place!! It’s a bit old school style and small, but it felt very homey and shower room and bathroom were clean and nice! (Hot water runs well!!) Also, host and employees were nice. If you have a lot of luggages, request a ground level room :)",5
"Just got home from staying here for a few nights and it was such a lovely stay! This air bnb is great in my opinion for getting an authentic NYC experience, the building is old with charm but well cleaned and maintained. The bed was super comfortable and though the room was small it came with a sink and a raising desk so it was perfect for what we needed. Relatively close to subway stations and on a calmer residential street. I would definitely recommend staying here!",5
"The place is very clean and well appointed. It does state its a hotel, but the bathroom and shower are shared - I missed that in the details but the place was great and they were very accommodating.",5
"We adored this spot! This cute little home base near by a subway entrance was a great home base for our NYC walking tours. Everyone was so kind and accommodating, and we came to find out that they do a lot of work in their community which was so nice to see. We would definitely stay again.",5
"It was a clean and lovely place. The location was convenient for getting around, and the room was warm and comfortable. The staff were also very kind and welcoming. I would love to stay here again. Thank you for a wonderful stay! 😊",5
"Super cute neighborhood. Very kind and responsive host. Loved the all day breakfast pantry =) Reported that the shower drain was clogged and host fixed it the same day. The place is calm, soothing, and feels at home. Free all day breakfast turned out to be a life saver... Our only challenge (disclaimer: This same feature might be common among hotels in the same area. Since it was my first time in NYC I can't say that this particular hotel had the issue) would be no sound proofing. So if you're a light sleeper, do bring ear plugs and problem's solved.",4
You get what you pay for - especially for New York City and this prime location. The best perk besides location was the offer of baggage service. That was incredibly kind and convenient to keep luggage since I arrived very early,5
"Stay was just as expected from description, VERY small space but worked for what we needed on our 2 day trip. Check in instructions very clear and easy. Host was very thorough in explaining the procedures and even provided links to make it easier. Shower was clean. Location was great, right by Penn Station!",5
"I had a wonderful stay in this apartment located in the center of New York city. It is small but very convenient for solo travelers. The floor was a little dusty, but the toilet and bathroom were clean. Thank you for welcoming me!",5
"Our stay at the village house was great for a short trip into the city. It so close to MSG, where we attended a concert, and everything was in walking distance. Would def recommend!!",5
It was very nice to stay at this Airbnb Everything was cool & the host constantly send messages to ask if everything was okay We really loved the area Chelsea is really pretty & it’s very walkable,5
"Nice place, great location, very comfortable and an excellent communication with the hostes.",5
"A group of boys came into the building at 3AM clapping, yelling slurs, and stomping. They were also throwing food all over the stairs. Because I was unable to contact the host, and so I had to confront the rude guests myself. I knocked on their door and told them off, and how I had already recorded and reported them to Airbnb, and they retreated. This is a fantastic place to stay, but just understand that you will have to deal with problems like these on your own, as there is not a 24/7 phone line to contact the host/groundskeeper. Other than that, amazing location, Anthony Bourdain's favorite pizza place is right around the corner, as well as a cheap convenience store, and restaurants/bars. This listing is perfect for two people that plan to be on their feet for the majority of the trip. No common space, however there are basic living amenities, and comfy beds. When they are awake, the hosts are very responsive and reasonable. Incredible value for the location and quality.",5
"It has a perfect location—peaceful and walkable. The room is really small; I wouldn’t recommend it for two people. The Wi-Fi doesn’t work well for more than sending simple messages, so I’d suggest getting a good cellular plan. Overall, you get what you pay for. I would definitely recommend this room if you are a solo traveler on a low budget.",4
"good stay for a good price, literally the bare minimum but it's more than enough for a trip to spend the daytime exploring NYC and have a place to crash and shower. As a few others mentioned, the hallways have a pungent smell but it stays outside, inside the room smells fine. Very pleased, would stay again!",5
"It is located near the Hudson, very good location, as for the place it is quiet, both the administrator and the owner were attentive they answer sover, the room corresponded to that of the photo, the only thing I did not like is that of the fourth guest next door, the administrator went to check and you can balance the bad smell. I recommend it if you travel alone or as a couple.",4
"Pros: Great location, smooth check-in and check-out, good communication and affordable pricing. Cons: The room had an unpleasant smell, and the shared shower was very small.",4
Perfect place for young people or those who are not fussy about comfort. Very well located. The host is very proactive and makes sure everything goes well! Matches the description perfectly. I recommend it.,5
"Great location and perfect for 2 of us who are students on a budget. It matched the description and our room was clean - the hallway had an unpleasant fishy odor, however. We reported it, and it improved, but then the smell came back.",4
"Koichi's place was the perfect spot for a few days in NYC. It's small but that isn't weird for NY. There was enough room for a chair (which was imperative since you couldn't sit upright in the lower bunk), a small refrigerator, a microwave, a sink (key since there is a shared toilet) and a little plugin kettle (which was lovely as I brought some tea with me). The floor needed a sweep but besides that it was perfect for the time I needed it for. Quieter than other places I've stayed. Thank you!",4
Great stay for the price and I’m glad I chose it. It’s in an ideal location especially for those who intend to be out exploring rather than staying inside for their visit. 5* experience!,5
Tiny space but it’s very close to Penn and the javits center right in manhattan,5
"The place is definitely worth it's money, good location, convenient to get to the subway. You get what you pay for, but it's worth every penny.",5
It was very good location. it was quiet. everything very good location. was quiet. everything you needed was clean and neat.,5
"Easy check in, clean room, toilets and showers, small cute room, everything u need for a stay in newyork, but the floor had always a strong strange smell",4
"The room was clean, though there was some strange smell in the hallway. The price is reasonable in New York. You can easily get to the apartment after exit the subway.",4
"as advertised. older building, but clean. very secure. excellent instructions for entry and no waiting to get in.",4
"It's a small room, perfect for visiting New York. It is located in the center, close to everything. It's quiet and clean. The toilet and shower on the landing are not bothersome, it was always clean and available. On the other hand, the bunk bed is wooden, different from the one in the photo, and seems really unstable. It moves a lot when someone is on top and gives the impression that it could break. It looks like a child's bed, it's not strong enough for two adults! Other than that, if we don't move, we sleep well. Translated from French Show original",4
Good value for the stay,5
"Great value for money due to the location, the space is small and simple, but very clean. Very comfortable duvet. A suggestion for improvement would be the bunk bed, it is swinging and needs adjustments. Translated from Portuguese Show original",4
"Rodrigo was kind, responsive, and attentive. He was a fantastic host and I felt safe staying with him as a woman traveling on her own. His place was very clean, even had a space heater and ear plugs, clean towels, and a number of another nice touches. Thank you so much, Rodrigo!",5
"Never actually met the host in person, but instructions for getting into the apartment were clear and easy to follow. The apartment itself was very comfortable. The host was very responsive over text and seemed to be genuinely committed to making sure the stay went well. For sure a place I’ll stay at in the future if I’ll need lodging.",5
Absolutely loved this space! Rodrigo was very accommodating and communicative and even allowed me to check-in about 3hrs early due to my flight arrival! The room was super comfy and Rodrigo had the cleanest bathroom/kitchen that I’ve experienced in my AirBNB history. The only regret I have was not staying longer so I had more time to explore (was only in the city for a day trip). Thanks again for hosting me!,5
"I had a wonderful stay! Rodrigo’s apartment was clean, confortable and exactly as described in the description. The area has great options for food and night life. The location was very walkable, near the train and buses, easy to use public transportation. Rodrigo was a great and a kind host, had a great conversation and made our stay so much better!",5
Great little apartment in a great safe neighborhood. Flew into New York for day to attend Yankees game and Rodrigo's place close to a lot of cool little places plus close to LaGuardia and not too far from the Bronx. For the price couldn't beat it either. Would definitely stay here again in the future!,5
Thanks so much to Rodrigo for hosting my teenage son and I on our brief time in NYC. His place was perfect for our needs. Great neighborhood where we could get a meal after our late-night arrival. Easy public transit links to Manhattan. We’ll probably stay there again. A+. Thanks again!,5
