review_text,stars
"I'd 100% recommend Willow's place. From the easy commute NYC>NJ>NYC, to clear instructions on how to check in, to restaurant recommendations, to friendly conversations and finally to the great spot to stay while visiting the city. I was a bit nervous about staying outside of NYC since my plans were all there, but boy was I wrong. Commuting to and from the Port Authority Bus Terminal is very simple and fast. You also have the ferry option which is a bit more expensive but worth it if you want to avoid traffic or want a beautiful view of the skyline. And speaking of that, what an amazing view you get of the city once you hop off the bus in Weehawken! Check in was smooth, bedroom was comfortable and shared bathroom was not a problem. Everything was clean and it almost felt we had the place to ourselves. A snowstorm hit NY when we arrived, so we had to change our plans a bit on the first day and stay in NJ, but there were great restaurants walking distance from the house. Thank you Willow",5
"9 years on Airbnb Rating, 5 stars , · November 2025 wonderful location, a choice of catching a short ferry across to Times Square or the v near and frequent buses to the central train options.",5
"Our stay at Willow’s was wonderful! The location is perfect for that budget traveler looking to stay somewhere that feels like home. Easy transportation on the 128/166/165 route from the corner into Manhatten. Download the NJ Transit app and pre-purchase tickets each time! From there let your feet or the subway take you anywhere! The bed was super comfortable, and everything was meticulously clean. Willow had a great selection of teas and coffee with various sugars and some creamer to start the day right! The view at night time of the Manhattan skyline is not to be missed! Easily walkable to many restaurants and local grocery at Lidl. Will look up availability next time I am in the area!",5
Couldn’t have asked for a better place to stay! Willow was extremely communicative and was very helpful with directions. This spot is so close to the bus stop which took us directly to NYC in less than 10 minutes!! The place was nice and homey - def would consider coming back next time I’m in the area!,5
"We stayed for just one night, and everything was perfect. The host was very friendly and provided clear, easy-to-follow instructions for check-in and the home. The space was immaculate, uncluttered, and had a calm, welcoming feel. The bed was incredibly comfortable, which made for a great night’s sleep. Highly recommend!",5
Willow’s apartment is amazingly clean and very beautiful! She was very responsive and communication went very well. The location deserves to be highlighted as it was just a few minutes walk to the bus stop to get into Port Authority Bus Terminal. Within less than 15 minutes you are in Time Square. We would highly recommend this apartment!,5
"Willow was an excellent host! Her place was quiet, very clean, and her instructions were extremely detailed. The bed was also really comfortable, to the point we asked what mattress it was! She was available for any and all questions, was proactive in her communication, and quick with her responses. I'm very grateful she opened her home to my daughter and me! I can definitely recommend her as a host! Thank you, Willow!",5
"This was an amazing location, especially for the price. Like anywhere outside of New York City, you can use public transportation or a Lyft driver as we did. The place was easy to find, easy to get into, and was in great condition. The host wasn’t even there, so it was very private. We didn’t stay very long inside, but I would definitely book here again for another trip.",5
"Perfect Location for NY. We were in the apartment for 6 days and really enjoyed the stay at Tony’s beautiful apartment! The apartment is close to the subway and in a silent area. Tony is a great host! He is helpful, easy to contact and very hospitable! We can really recommend this apartment for everyone who want to explore this amazing city!",5
Tony was a fabulous host !!! The house is beautiful on one of the most beautiful blocks in Manhattan. The room was clean and comfortable and afforded a nice view of the street. Tony did everything to make my stay enjoyable. I'll be back !!!,5
"Tony’s place was impeccable. From the beautiful layout and spacious design, I could tell this place is taken really good care of. I appreciated the informative check-in that truly helped me navigate the space. Was completely hospitable.",5
"Tony’s house is very artistic, clean, and spacious in Manhattan! The house looks exactly like what is shown in the pictures. It locates on a lovely street, close to the subways and just a stone’s throw away from the Central Park and everything else! There are many supermarkets and cute cafes nearby too, so staying here is really convenient. Tony is an amazing host, super kind, respectful, and responsive. I would truly love to stay in this pretty house whenever I visit NYC!",5
"It was great, Tony’s a great host and make sure you get what you need and is very accommodating. Did come during a film set and he made it easy to get to my room and out which I appreciate. Spacious and clean.",5
"9 years on Airbnb Rating, 5 stars , · August 2025 Tony’s place was everything that we hoped for. Not only was his home aesthetically mesmerising and filled with beauty but also felt very clean, safe and offered us some privacy. As a host Tony is extremely gracious and attentive and helped us to feel comfortable in this glorious city. Would definitely recommend a stay here!",5
"We loved staying at Tony’s! He is such a warm and welcoming host and accommodated everything we had asked for and beyond, I will definitely be booking again the next time I am in the cities!",5
"I’ve traveled all over the blue green planet and can honestly say, without hyperbole, that my weeklong stay at this late 19th century architectural masterpiece tucked away in historic Hamilton Heights of West Harlem is one of the most memorable and magical Airbnb stays I’ve experienced yet. The neighborhood, the art, the history, the energy, the little Italian restaurant around the corner (that perfect bolognese), and the most generous hospitality — my only serious complaint is that I found it extremely difficult to leave! This place is an absolute NYC lover’s dream. Thank you for everything Tony, I can’t wait to return.",5
"Tony has been a great host and provided a warm welcome ! The room itself is quiet and very comfortable, and located inside a spacious, stunning building. The neirbourhood is really nice, with a lot of deli shops, a subway nearby and coffeeshops. We loved the place !",5
Tony was such a gracious host and so very kind. He always responded to messages within an hour and was available to give us recommendations of things to do in the city. The house is beautiful and the neighborhood was quiet.,5
"Tony was an excellent host! He was super hospitable, and gave very detailed information on the house and its' amenities – he was always very responsive to any messages, and any queries in person as well. Seems like he has a lot of cool stories to tell! The photos do not do justice to the beauty of the house, and the room itself was so delightfully spacious with a great view! The neighborhood is also super peaceful, and easy to navigate, especially when heading downtown. Great place, would highly recommend staying with Tony! Thanks a bunch for the amazing stay.",5
"A great place to stay in New York. We probably wouldn't have visited Harlem if we hadn't booked a place to stay in this area. We were very happy with our stay. It's a beautiful area, and Tony is a great host who recommended some great places.",5
"Tony’s place is a haven that feels like a home away from home. Although I was born and raised in New York, I now reside in a different city. It’s wonderful to find a place where you eagerly anticipate returning to your hometown. Tony’s home is that kind of space. If you appreciate the beauty of well-kept old brown stones that radiate warmth, coziness, and cleanliness, then Tony’s home is the place for you. I thoroughly enjoyed my visit there.",5
A beautiful and spacious room! Tony was very responsive and helpful during our stay. This is a great spot to stay while visiting NYC!,5
Tony was amazing and very responsible. He went far and beyond to make my stay comfortable. He even helped me with my heavy luggage and made sure I boarded. This has been the best experience so far as a guest. I recommend him 100% and I hope to return. He also gave me great advice on how to start in the art world.,5
Tony was a host you could only dream of but he's real! He greets you at the door and is very responsive. He gave me a tour of his beautiful home which feels like I'm stepping into history. The location is safe and I walked by myself alone at night and felt comfortable. The train is a 7min walk away. The room was huge!! If you have claustrophobia stay here because you can move and breathe easy. Great stay and I will be back. 😊,5
"We had a great stay at Tony's place. When we arrived, he was there to welcome us and show us around his lovely home. We really enjoyed the art and antiques located throughout. The location worked for us because it was quiet and a quick walk to the subway, making it easy for us to get to everything we wanted to see and do.",5
"Every review you read is spot on. This is one of the most fabulous places we’ve ever stayed and by far,the most unique experience. Tony is an incredible human being. He was extremely helpful and a pleasure to be around. Super grateful for all of his help while we navigated walks and the subway system. We will stay much longer next time to be able to explore the beautiful neighborhood and enjoy more of Tony’s company.",5
"comfortable room with shared bathroom. Tony was a very nice host, responded quickly and was very helpful.",5
Tony was an extremely helpful and responsive host. It was a delight to stay in this unique gem of a home in Harlem. Loved the neighbourhood and its close proximity to transit while still being situated on a beautiful tree-lined street.,5
"A very good place to stay to visit Manhattan! The house is impressively spacious and very well decorated, with plenty of art pieces and classic furniture. Tony is a very welcoming and responsive host.",5
"3 years on Airbnb Rating, 5 stars , · July 2025 I really enjoyed my stay at Tony's. The house is beautiful, well-kept, and spacious on a quiet tree-lined street. Tony is an exceptional host; ever so generous with his time, suggestions, and recommendations. At every turn, he was highly thoughtful and went out of his way to help. Highly recommend!",5
Tony was very hospitable and accommodating. He reached out immediately letting me know how to find him and gave me all of the transportation options available. The location was great and the room was very comfortable.,5
"Beautiful, historical house , close to subway lines A, B, C and D as well as a bus line. Nice walk to Harlem YMCA and Schomburg Center for Research in Black Culture, Apollo Theater, walking tours, etc. Quiet street lined with beautiful trees. Huge, well-equipped kitchen.",5
"My stay overall was nice, the host was very communicative and friendly and the bus route to get into New York was very easy and convenient. When I booked my stay I didn’t realize there would be other people in the home besides the host, so just be aware there are multiple rooms all sharing one bathroom.",4
"Great place to stay. Check in was very easy thanks to Odalis’s instructions. Good location, buses that go to NYC- port authority bus terminal, usually arrive early and it takes about 30-40 minutes to get there so pretty easy. For tickets-download NJ transit app and select interstate 2 zone ride. Room was accurate and really nice, everything clean. Thank you for hosting me!",5
"Such a lovely stay and the loveliest host ever. The room was clean and nice, the host very responsive and accomodating and even treated me to some Cuban food at the end of my stay (which was delicious). Loved every minute of my stay and if have the chance will be returning. Muchas gracias❤️",5
"2 years on Airbnb Rating, 5 stars , · January 2026 Odalis was very warm and inviting, always offering coffee and food and going out of her way to make me feel at home. Great suburb and easy commute to Manhattan",5
I arrived really late. She made it really clear with Instructions on how to get in. She is a great host that cares about people.,5
"Great spot for solo travellers, long or short stay. Odalis was great, responsive, kind. Definitely will stay on my next trip. Amazing Host.",5
"The host is very attentive, and the cleanliness of the place is a big plus. However, I did experience some noise at night and had trouble sleeping at times. Also, the connection between NJ and NY is complicated and expensive: the transportation is not very comfortable, often crowded, expensive, and sometimes infrequent. Still, the view of NY from NJ is definitely worth it If you’re a city fan like me.",4
"Odalis is a very friendly and helpful host, and the room and bathroom are immaculately clean! You can get to Port Authority in less than half an hour and there are so many great restaurants in the neighbourhood so the location is great!",5
Odalis home was easy to find and close to bus stops with buses directly heading into main city New York! It was well lit at night and generally had a friendly and safe atmosphere.,5
"1 year on Airbnb Rating, 5 stars , · March 2025 Very polite and soft spoken. Odalis is responsive on DMs and keeps the place clean. The space is small but apt for the price for upto people and has one of the most clean washrooms I have ever been to. Owner has kept all utilities in washroom and kitchen for us. Gracias !",5
One the best hosts I’ve had. The place totally worth the money.,5
"Odalis is a very kind and caring, I've got sick on the third day and she took care of me like if i was her own son and made sure i was okay on each day, thank you for everything and I'll definitely be back again for sure.",5
"Good place to stay, very attentive and friendly host ;)",5
"Super place, steps from the bus stop that is super close to NYC. Supermarkets nearby. Walking distance to a street with a spectacular view of Manhattan. Odalis is super friendly, a super good host, gives super good tips and makes you feel at home and familiarizes you with everything you need to know. Definitely recommended :) Translated from Spanish Show original",5
Odalis took very good care of me during my stay. Always responsive and friendly.,5
"He was a really great person. The room is also clean, quiet and safe. We will be back. Translated from Japanese Show original",5
"Everything was wonderful! Odalis is an amazing woman who cares about making you feel at home. The location of the Airbnb is perfect since it is close to supermarkets, restaurants and bus stops. Transportation to downtown New York is very easy. Thank you very much for everything! Translated from Spanish Show original",5
"Odalis is an excellent host... quiet place and very well connected to NY in just 25 minutes. Everything is clean and she helps you with everything you need. When I go back to NY, I'll definitely go back to his house. Also two blocks away is full of shops for everything you need. Much cheaper than NY Translated from Spanish Show original",5
"7 years on Airbnb Rating, 5 stars , · September 2025 It was convenient to go to New York from the accommodation, and the accommodation was clean! It was perfect for a solo traveler. I was really satisfied with the price compared to the murderous New York prices. The host is also very attentive and always responds quickly! It was a little difficult to communicate directly because I couldn't speak Spanish, but it was still good. Translated from Korean Show original",5
They took care of me so warmly from the time of check-in! I want to stay again next time I go to New York :) Translated from Korean Show original,5
"great place, thank you!",5
"I love Oladis! I’ve been visiting New York for about two years now, and each time I visit, I always stay at this Airbnb. It’s completely safe, and as a female solo traveler, I feel very comfortable here. This Airbnb is fantastic! I love Oladis, her place is always spotless and clean. It truly feels like my home away from home. ❤️",5
"Odalis is an absolute angel and it was so great to have her as a host. She's caring, thoughtful and communicative and it was so great to talk to her and learn some Spanish. The place is obviously not very central but the bus to Port Authority isn't so bad and is mostly quick to get there. Highly recommended.",5
"5 years on Airbnb Rating, 5 stars , · October 2025 It was nice to use a private room like a share house. It's a shame that there's only one bathroom, but it was very good for relieving the fatigue of travel. Translated from Korean Show original",5
Pia’s place was just what we needed for our weekend trip to New York! It’s budget friendly and in a safe neighborhood. The bedroom was cozy and had all the things I needed that wouldn’t fit in my carryon. I would recommend this place.,5
What a wonderful place to stay with a warm and inviting host. We stayed for 5 nights and had a nice experience. Other guests were not intrusive as everyone has their own room with number lock. The shared living area is spacious. The entire place is hospital grade clean. Would stay again.,5
Pia’s place is perfect if you’ve never been to NYC before. Finding the place and entering was super easy! We had a sweet view and her responses to questions were so quick. We would love to stay again and I highly recommend it!,5
Piedad was the most friendly guest I’ve ever met at an Airbnb. She treats you like family and is very accommodating to your needs if you have any questions/troubles. She is the sweetest! And the stay was just as comfortable and affordable. Definitely recommend for anyone visiting NYC!,5
"Place looks exactly as the photos, easy to find and place was the cleanest we’ve been. Without doubts, the best place we have ever been. A very convenient location, near of manhattan, 30 mins in subway to any place. Very very recommended, Pia is the best as a host, very responsible and helpful with every single issue and feels like having an extra mom there, we cannot wait to come again.",5
"Piedad is a lovely host, and the room was comfy and clean, just like the rest of the appartment. It’a 15 min walk to the closest train station, but if you like to walk, there’s also a station on Roosevelt Island and the air tram with great views. The island is also perfect for runners, just cross the nearby bridge.",5
"Piedad is an exceptional host that made me feel right at home during my short stay in NYC. The room and the apartment had everything one can need and more, the mattress was very comfortable, everything was very clean and smelled well. Piedad was extremely kind, you can see she enjoys hosting people, and she lives and breathes New York. I'll be happy to book again next time I'm around! Thank you Pia!",5
"The room and place were beautiful, pia and her daughters were so sweet and welcoming. Felt very secure with keypad lock on room door and bed was very comfortable and adjustable. The shared bathroom was beautiful with a shower that had multiple heads and a heater, and the kitchen we didn’t use but was very nice and accessible.",5
"Pia is an incredibly friendly and truly wonderful host. From the very beginning, she was extremely helpful, kind, and attentive, always ready to explain everything and assist us with anything we needed. Her place is absolutely perfect — spotlessly clean, crystal clear, with everything shining and smelling wonderfully fresh. You can really feel how much care and love she puts into her home. It was a pleasure to stay there, and we are very grateful for such a warm and welcoming experience.",5
"Our stay was absolutely wonderful! The place was very clean, beautiful, and well-organized. The host was friendly and welcoming, which made us feel right at home. The location was perfect — only a few minutes away from the subway station with two convenient options nearby. The neighborhood was quiet, peaceful, and felt very safe to walk around at night. Overall, it was a relaxing and enjoyable stay. If we ever come back to New York, we would definitely stay here again!",5
"I had a lovely stay in this home—so much so that I’ve adopted Ms. Pia as my aunty now! LOL The bed was cozy (massage functions!), vanity was cute and compact, TV was a nice size, bathroom was beautiful (next-level Bluetooth shower!), and common spaces were clean and comfy. Ms. Pia is an absolute pleasure and makes you feel like a priority in her home. She also gives great recommendations for local eateries should you need it. I’d definitely recommend and return! ❤️",5
such an amazing place ! Decent distance away from manhattan but such an easy commute! Pia was so kind and so were all her neighbors!! Hopefully you get to see the cute orange cat that hangs around the neighborhood!!,5
Piedad was there when I checked and showed me everything I needed to know. She gave me recommendations for cafes and restaurants close by. . very friendly. The bed is amazing. The whole place wonderful. i will stay there the next time I'm in New York,5
This was a delightful air bnb. Pia's home was a slice of heaven after a busy day in the city. She welcomed us with open arms and made sure we had everything we needed. The home has essentials and extras. The house is close to bus stops and a market. Would absolutely recommend her place.,5
"piedad was a wonderful host, greeted us before we got in the room, the place was VERY clean, more convenient than any hotel we could’ve had, super walkable and easy to manage. would recommend to anyone who wants to feel like they’re more of a local rather than a tourist!!",5
"Potentially the best Airbnb stay I’ve ever had. All toiletries were waiting for you in the spotless room right as I walked in. Toothbrush, toothpaste, slippers, towels, and a robe were waiting for me without having to request any of those items. The bathroom was immaculate and features the nicest shower I’ve ever seen. The place is a couple minutes from the closest bus station, and it’s only about a 15 minute walk to the subway. Piedad was incredibly responsive and helpful.",5
They were absolutely amazing and helpful at all hours. I will 100% stay again if they’d have me. Check in and everything was easy. It was a pleasure!,5
"very comfortable and always felt safe. pia is so kind and very welcoming, thank you again! also the shower was super nice.",5
"By far my best rental experience ever. Pia goes way above & beyond to anticipate anything you might need. The apartment is immaculately cleaned, linens are fresh & fluffy, the mattress is comfortable, the bathroom shower head is spa quality & each room has temperature controls. The location is quiet with easy access to public transportation and several Cafes close by. I highly recommend Pia for your next stay in NYC.",5
"Cozy and well-stocked spot in a convenient location in Long Island City, just a few blocks from the F train to Midtown. The place was much cheaper than a hotel in Manhattan, and just as comfortable. Piedad was an excellent host as well. I would definitely recommend this place if you’re looking for a more affordable stay in New York.",5
"It is a fantastic place in Astoria—very convenient for visiting New York at a reasonable price. The subway station is close, and from there, you can easily get to Manhattan or other places. The room is very comfortable, the bed is fantastic, the TV is good, and the bathroom is spacious and very clean. The entire place is impeccably clean. The host is very friendly. I 100% recommend it and will return on every visit to New York.",5
"Great place to stay: clean, comfortable, convenient. The instructions were very clear and communication easy. Would definitely stay there again",5
She was friendly and helpful. The place was very clean. All around great place for a good price. I'd definitely book here again if I'm needing a place to stay in NYC.,5
We had an amazing time in New York and in this apartment. Piedad was an amazing host. We were well taken care of. We would definitely come back to this apartment.,5
"The place is really cozy, a few cheap good options to eat around, near train stations which makes it really good if you’re into knowing manhattan and New York in general. Neighborhood is pretty calm, even arriving late at night, check-in was flexible and house was super Clean. Gloria was super helpful and gentle, would definitely recommend her place to anyone coming alone to NY.",5
"i had a great stay at gloria's home. her home is very clean and comfortable, and has everything you need. check in was clear and easy, and i was able to do laundry as well, which was so helpful. the location is amazing, in the heart of bedstuy and near public transportation. gloria was very helpful and checked in periodically. highly recommend her home to anyone passing through brooklyn!",5
"Gloria was very accommodating, and the location was perfect for my visit in NYC. The neighborhood in particular was very beautiful and I found easy access to every place I needed to commute to all around the city and different boroughs. Would fully recommend this location if you need a centralized place that will get you around easily.",5
"Everything was fantastic! The apartment was perfect, and Gloria was very kind and helpful. She even kindly let me leave my backpack after checkout while I continued exploring New York. If I have the chance, I would definitely stay here again",5
