review_text,stars
"I’ve stayed in a hostel once before, and this one is nothing like what I imagined a hostel to be. The place is wonderfully cozy, warm, and has a homey feel. The location is excellent, the pods are comfortable, place is squeaky clean and the staff is amazing. On top of that, they even offer breakfast and really great coffee for guests. For the price and location, it’s unbeatable. I would definitely stay here again!",5
"The people in the photo (hosts) are not the people I ever saw at this location and don't seem to be on site. It was as described, and you should know that it is run by Hare Krishna. They are doing great work and offer simple meals at any time of the day to anyone staying. Everything was clean, and all of the hosts were friendly! I would stay here again!",5
"this is my fifth time visiting manhattan and this is my definitely amongst my favorites for accommodations i've stayed in. very cozy and clean, you'll feel right at home! they always have food and drink for guests, and the bathroom is even kept well stocked. it's nice and quiet as well, with quite a safe and comfortable feeling atmosphere. very kind and warm hosts that keep a lovely place, i'd definitely stay here again next time i'm here",5
"I love this place! As newbie coming into the city for work trips, this hostel is perfect for a couple days. The location is an easy walk from penn station, the staff is kind, and the place feels safe. Inside, it is clean, welcoming, and warm with snacks and coffee. The only issue I had were the late arrivals, 11 pm or 12 am, keeping me awake when I had to work in the morning. Otherwise, it's is great for a solo trip!",4
I have never stayed in a hostel before so I was a little nervous at first. This was a great experience. Photos are accurate. Everyone was respectful about quiet hours. The community area and kitchen was fantastic. The scones are amazing!! The staff is so helpful and friendly. I had no problems at all. I would definitely come back!,5
The host are very welcoming & explain everything to you about the place when you arrive. There’s always someone in the office 24/7 if you need to reach out. This is my go to whenever I’m in NYC. Beautiful Zen space for the solo traveler. I love the Chelsea neighborhood. The Italian restaurant & improv theater is right around the corner. Both are excellent! I highly recommend. 🙏,5
"The place was more expensive then what I would expect, but I enjoyed the location and hostel. the staff was really nice, the site was flexible in access, and the space was super clean and organized. I would definitely visit again based on it's proximity to work, the train, and my favorite places in Manhattan. Instructions were super understandable and the communication with the host was great!",5
"great place. exactly as described. friendly hosts and staff. the place is so clean, and the location is perfect. the 24hrs check-in option really worked for me! Read the description carefully, it is not a typical stay. (the fact that sound travels easily can interrupt your sleep if you are a light-sleeper.",5
"My husband stayed here for one night and then had to leave it was so bad. Hugely misrepresented in the airbnb photos and reviews. The cubicles were like cells. It was horribly loud, you could hear literally everything. He said he heard talking, snoring, and farting well into the night and even with earplugs he couldn't sleep. Bodily functions don't obey quiet hours. The hosts were kind and it was clean but this is bare bones. Is it really so expensive to put up some real walls? At least old school hostels used to have actual rooms.",2
"The staff is great, the room is clean, and the overall atmosphere is cozy. The team was very attentive and strongly emphasized the importance of keeping quiet. During the night, I understood why. Since the cubicles are not closed at the top, you can hear absolutely everything other guests do during the night. For me, this was unbearable, and I had to cancel my reservation the following day. I only recommend this place if you are a very heavy sleeper.",3
"4 years on Airbnb Rating, 5 stars , · 2 days ago This place was fantastic for the budget. I couldn’t ask for more. The daily free breakfast of bread, milk, and fresh fruits basically pays for itself to a certain extent. The room is small so it’s perfect for people that just need a place to sleep. But one thing to note is that you can’t bring any meat product in the building - which includes eggs and any canned food. It was a challenge for me to find affordable high quality protein for myself that needs to be eaten outside, so keep this in mind.",5
"Great stay, very affordable, clean showers and bathrooms. Nice breakfast area and fun cubicle like rooms with good wifi. Excellent location, staff is always available on demand 24/7 would book again a heartbeat.",5
The place is very clean and cozy. It is very helpful having someone 24/7 at the reception. It feels safe. There are a lot of breakfast options. Everyone is friendly. It is good value for the cost definitely.,4
"very good spot for a short stay in NY ! extremely well located, flexibility with check in, breakfast available, kind and responsive people. I can recommend it with my full heart !",5
"I had an amazing time at this place! The location is just great, and the amenities were surprisingly nice. Yana's scones are THE BEST thing ever, and she's a lovely person. Shout out to Jeremy, who was so nice as well. I look forward to staying here the next time I visit NYC.",5
This was my second time staying at Interfaith and I’ll definitely be back again! The location is absolutely incredible - 20 min walk to the Theatre District and Times Square. Staff are so pleasant and accommodating. Highly recommend.,5
"This place exceeded my expectation! It is a hostel style so all the cubicles are small and not closed all the way up (important!). However, due to well management, guests are fairly quite and considerate of others so my stay was easy and calm.",5
Wonderful place to be for a solo trip in the city of New York for the first time ever. I enjoyed how small and relaxed the place was. Was very clean and comfortable. I loved how close to everything the building was. Definitely hope to stay soon.,5
My only complaint is that the cubicle got kinda hot at night which made it difficult to sleep. I also encountered a guest who was trying to check in late at night and was not able to reach anyone on the phone. My check in went fine though. Overall I had a great stay,4
"clean, comfortable, convenient described very accurately read everything in the ad and in the messages and emails to know what to expect 24hour access to a variety of food was great friendly, helpful staff",5
"This place is exactly what is described. The location was great. It’s all I needed for my trip since I was only there for 24 hours. It’s walkable to everything, there are subway stations within 4 mins. I couldn’t have asked for a better spot.",5
This was a wonderful experience. I highly recommend staying here if you’re a solo traveler. The place is just as pictured and close to many of the main attractions. I wish I could’ve stayed longer.,5
"It is as described. Place to sleep and shower. If that’s what you’re looking for, it works well. Right by the ACE and 123 line, and Penn station. Instructions to check in and out were clear and easy.",5
Had a wonderful stay! Walkable distance to touristic places as well as the subway so transportation was easily accessible. I felt respected by the host and other guest. Communication was great and easy going! Will definitely stay again.,5
"As a first time solo traveler to NYC, this was the best place to stay I could have ever asked for. Loved how close it was to Penn Station, the ability to hold my luggage before and after check out, and how responsive the hosts were! Such a bang for your buck, I would recommend it to anyone!",5
"Amazing prime location, and very good price for that location. But some conditions like no non vegetarian foods allowed and lack of roof(everything is audible to everyone in that floor); these conditions are little harsh. But they were mentioned clearly while booking the room, so read throughly. Definitely need to vacate, if we violate the conditions. Other than food and sound privacy, host is amazing and friendly, very responsive and respectful. Nice location and price. Check conditions and book.",3
"This was my second time at this location. I had stayed at the New York Spirit Retreat (same location 4th floor) earlier and was pleasantly surprised to see the difference in comfort at Interfaith- the bathrooms are much more spacious and the space overall is much more comfortable. Love the common area on the 3rd floor. As a vegetarian myself, I loved that no meat, eggs and fish are allowed. The staff is responsive and amiable. I loved reading, praying and connecting with more folks at the building. The muffins were my favorite.",5
This is my second time at this hostel and once again everything was great. They really take care of you and make sure everything is squeaky clean! Staff are all helpful and kitchen options are awesome. Thanks again guys!,5
"Booked for 4 day 3 nights, but couldn't stay there after the first night and checked myself into a hotel. Everyone around you is snoring; and they employ a Chinese lady at night to keep watch and wake up snorers - but you can't sleep either way. 25 cubicles with beds 3/4 size of a single bed, and only 3 bathrooms and showers, walking around in circles to get there. If you're on a tight budget this might be for you, but if you have some standards book yourself a hotel.",1
"Lovely, accommodating, and communicative hosts. This Airbnb is situated unbelievable close to the “heart” of NYC. I couldn’t have chosen a better place to stay and I’ll definitely be back.",5
This is my go to place whenever I’m in the city. Very convenient Penn Station and the word authority. I always feel at home there very Zen and peaceful. Highly recommend.,5
"Excellent location—everything was within easy walking distance, which made the stay especially convenient. A thoughtful touch: complimentary earplugs were provided, which proved helpful at night given the close proximity to neighboring guests.",4
It’s my go to place when I’m in the city. Chelsea is very convenient to Penn Station & Port Authority. Friendly and helpful staff! Zen & peaceful. I highly recommend for the solo traveler. 😊☮️,5
"A wonderful place with a very pleasant atmosphere. You can really feel the care for guests: cleanliness, order, and comfort are at a high level. The staff is friendly and helpful. A great option both for a short stay and for long-term accommodation. Thank you for the hospitality!",5
"It was an amazing stay, had the best time. Definitely recommend this place to others, and for myself too, for the next time! Absolutely clean, hyegenic, and a good vibes stay! Loved it, had so much peace. Thank you !",5
"I’m really glad I stayed here. The room was always kept extremely clean, and the location was very convenient for getting anywhere. It felt like it gave me more time to truly enjoy my trip. I would definitely love to stay here again!",5
"It has been a nice experience staying in new york city which was my ""home"" in a short period, and this stay was very friendly and the cost is unprecedentedly nice and the home made cookies are nice.",5
"Just what I was looking for everything is super nice, I arrived in the morning and they offered me breakfast, it was incredible, and the day of my departure they kept my things to continue enjoying NY, super recommended... just don't make noise that if it's very serious.",5
"This is a good option if you are in need of a place for the night. You get what you see in the photo - for walls and a mattress. My stay was decent, everyone seemed to understand the rules and were respectful of each other.",5
My first time visiting in new york city and so glad I booked this bnb ❤️ I got well rested and people at the front desk are nice too! Great people and great team! I will definitely come back here when I visit new york again 🥰,5
"If you need a simple bed and private “room” for a very good price in the nearby of NYC, this is it. Perfect for solo travelers and if you want a budget bed to crash on. Showers, toast/bagel breakfast, and the private, locking door space are great for the prime location next to MSG and Penn Station",5
"Perfect location, very clean. Easy check in and out - thank you for making everything so convenient!",5
"PROS: Location is top notch. The staff is VERY friendly. Shared bathrooms/showers very clean. Water machine broke one day and was immediately worked on and fixed. The staff is great. Love that they offer drinks and small snacks at all hours. Staff member there at all times. CONS: It is small- so do you research and check measurements- I'm 5'9 and the bed was too small for me. I hit my head twice in the bathroom- but again they do list measurements in listing so just make sure room would work for you. My biggest complaint is the noise. They do their best- but there are snorers. You will hear MULTIPLE alarms going off all before 7am (some being hit on snooze or just left on for minutes at a time) and even though they have ""quiet hours"" there will phone calls/facetimes all around you. The best sleep I got was midday- but my sleep was severely affected unfortunately by other tenants. So it's the roll of the dice and hope you get decent people with manners. Besides the noise- great stay.",3
"Great solution if you want to stay for a few nights in Manhattan on a budget! Perfect location, quite clean, friendly staff available 24/7, breakfast included. The ceiling of the cubicle is open, so you'll get the snores (and smell) of your neighbors, but it's clearly communicated in advance. I stayed 6 nights; during two nights the staff woke up others to stop them from snoring, and one night the police even came because someone didn't collaborate. The staff handled everything very well though and I never felt unsafe, but even with earplugs I found it sometimes difficult to sleep. Lastly, Im 6'3"" (190 cm), and didn't fit flat on the bed as it was a bit short. Luckily I'm a side sleeper! Would definitely recommend and come back as well! Thanks a lot!",5
Lovely hostel. Rooms are small but if silo traveling it’s perfect. It’s also in Manhattan so it makes traveling easy. 10/10 I’d stay again! Friendly staff.,5
"This place is budget-friendly, and has a walkable distance to great restaurants and metro stations. The hosts are easy to communicate with; the staffs are professional and available 24/7; the restroom is surprisingly clean with spotless toilets. As mentioned in the description, the rooms are not soundproof. I appreciate the hosts for being upfront on this issue, and for their efforts in maintaining the quietness, such as having the quiet hour from 8pm-8am, and providing the earplugs. However, there are about 10--20 guests, so it is hard to make sure that everyone stays quiet throughout the night. I am kind of a light sleeper, but I am on budget, so I tried this place; I turn out to be ok with staying for one night, but two nights or anytime longer starts to be difficult for me.",5
Great place to stay if you are in the city by yourself. The hosts are very friendly and considerate with privacy and respect,5
"I loved the cubicle, it gave me everything I needed with was a place to sleep and enjoy the areas of the city.",5
"My second stay and it was just as great as the first time. Excellent location, quiet accommodations, all for a great price.",5
"The place was cozy and nice, perfect for single travelers who need a cheap stay in central NY",5
"A truly meaningful stay. Volunteering was a wonderful experience, and the hosts were incredibly kind. Great location.",5
"Definitely recommend to people who are solo travelers. I always wanted to go to NYC alone but did not want to pay 200$ by myself for a hotel room. Also I love watching musicals, going to jazz bars so saving money by staying in New jersey was a bit tricky. I would say this is the best place if u are wanting to enjoy the night of NYC + want to stay close to the penn station. It is 5 min walk from Penn station and the broadway is 7-10 min walk. The famous Jazz bars which I love to go, birdland is also 7 min walk. Absolutely loved it. About the bathroom, I kinda have anxiety of sharing bathrooms but to my surprise it was always clean. Loved it. The only thing I will say is about the bed size. It was fine with me to sleep on but I do not think you will have a good sleep if you are a big person, tall or big :) Anyways the staff members are also nice and u can drop your bags in the place which is really helpful if u r planning to immediately start hanging around in NYC.",5
"A great stay for the price in Chelsea. It’s communal living and everything is spotless, and the staff is very friendly and helpful. Definitely a go-to stay when in NYC.",5
"Terrific location, well-run hostel, friendly and helpful staff. Will absolutely stay there again.",5
"I had a great time at this hotel! My room had an amazing view, the location was right where I wanted to be, in Times Square, near different theaters. The check in and check out were very easy. All in all, I would stay in this hotel again and make sure to stay in it if i wanted to stay near Times Square again.",5
"I had a great experience staying at the Hilton in New York City, from the moment I checked in, to the moment I checked out. Michelle at the front desk, was very helpful and even checked us in early. I’ve stayed in New York multiple times and this was by far the best place I’ve ever stayed at and also the cleanest. It’s in the great location and I would definitely stay here again!",5
Great location for getting around. Near to all underground stations. Good heating in the room. Room was quite small and nowhere to put heavy clothes. Kept it all in the cases! Comfy bed. Coffee maker and microwave.,5
We completely enjoyed our stay. It is central to everything which made commuting and seeing sights easy. Host was great and answered my questions beforehand. I would definitely come back!,5
"I absolutely loved my stay here. I would highly recommend it if you’re coming to NYC for the first time. Everything is walkable, Times Square is right there, and subways are nearby. Staff was incredibly kind, and Jason was a very friendly and responsive host.",5
E3ally liked the experience apart from the $30/night charge that was added to 2hat I paid through Airbnb. Supposedly for wifi and dry cleaning whether you need it or not. Other coupons were included but this significant additional expense per night came as a surprise at check in.,5
"Great location. Walkable from time square and right in front of the hop on hop off stop which was extremely convenient. Room was super small and barely had space to walk around, but in all a good place.",4
"perfect location to visit downtown NY. Time square is right after the corner, central Park 25minutes by walk. everything was as desired. The lady with glasses at the front desk was so kind and helpful. Kudos to her!",5
"The location was close to everything—literally steps from Bryant Park and right in the heart of Times Square. It made getting around NYC incredibly easy, whether we were sightseeing, shopping, or grabbing food. The staff was extremely helpful, friendly, and accommodating from check-in to check-out. The room was clean and comfortable, and despite being in such a busy area, it was surprisingly quiet at night. I would definitely stay here again and highly recommend it for anyone visiting New York City.",5
Hosts were responsive to original reservation and everything was exactly as they said it would be. Location could not be beat!!! restaurant on premises and very friendly front desk staff!!! We will definitely be back!!!!,5
I had a decent stay at this hotel and my host was very responsive.. place was very clean and nice.. I’ll surely book again sometime in the future and all recommend it to friends..,4
"Great facilities and an awesome location! It's a block away from Times Square and Bryant Park. We took the Hop-on Hop-off bus right outside the hotel and the Newark Express to Newark Airport in front of Bryant Park. You can walk to most NYC attractions from there. In the lobby is Paul's on Times Square restaurant, which has great food and service. We went to NYC for my father's birthday, and he was amazed by the hotel.",5
"My stay at the hotel was great. It is located just steps away from the most popular clothing stores, such as Zara and H&M, very close to Bryant Park, and only a short walk from Times Square. Truly a perfect location to visit the city’s iconic spots without the need to take a taxi or public transportation. The room met my expectations, and the service I received at the front desk was appropriate.",5
"If you’re looking for basic room and amenities in the center of NYC’s Times Square, Hilton Garden Inn is a great place to stay. The price is right and it’s a walking distance from a lot of touristic attractions. I prefer a quieter location with more amenities for an extra price per night. But this was perfect because it was a walking distance from my conference.",4
"My stay in NY was amazing, big part thanks to hotel staff! They were all very supportive, helpful, kind and so good in what they are doing that i was amazed! thanks to all!",5
The Hilton Garden Inn was a wonderful hotel and I would definitely stay there again. The staff was amazing and our Airbnb host. Jason was extremely accommodating and very helpful with any questions we had.,5
The hotel itself was clean and comfortable. The cleaning staff was super attentive and made sure we had what we needed. Check in was simple and the free coffee was so good. Everything was walking distance and near transportation. I would definitely rebook with them.,5
"The hotel was in the best location, close to the subway, walking distance to the middle of Times Square and the best food places all within walking distance. Hotel staff were so great! I would definitely stay here again! Jason was very responsive to any messages and very helpful!",5
The hotel lobby and room were well maintained and the staff was friendly and helpful. My room on the 27th floor was surprisingly quiet given the location and the bed was comfortable. The hotel is in a great location and was really close to Bryant Street Park and the subway system.,5
"Amazing location! Perfect for getting around the city. Rooms are small but that’s NYC, and everything was extremely clean. Will definitely consider staying again next time!",5
"We had a wonderful stay at Hilton Garden Suites Times Square Central! The staff was friendly, welcoming, and always helpful, which made our trip even more enjoyable. The location is perfect—right in the heart of Times Square, making it easy to walk to Broadway shows, great restaurants, and subway stations. The room was clean, comfortable, and had everything we needed for a convenient stay in New York City. Highly recommend for anyone looking for a central spot with excellent service!",5
Great place to stay! Staff was very friendly and gave great recommendations. Lovely restaurant in the lobby and beautiful room + view.,5
"Great location right in Times Square! Easy check in, beautiful views, & fantastic service! Thank you will come again.",5
I had a great stay. Beautiful views very clean and very clear instructions for check in and check out. I will be booking again in the future !,5
"Everything was as advertised and the location was extremely convenient for all the Christmas markets, Broadway shows, and New York landmarks.",5
"Hotel was in a great location, literally steps away from Times Square and close to the subway! My husband and I had a great time and we will be back!!",5
Amazing location. The check in process was very smooth even with a very long queue. The staff were very helpful with all my queries.,5
"Great stay! The shower was incredible! Quiet, Friendly, efficient, held our bags for no charge. Perfect everything.",5
"Centric place to stay at, close to the metro which made it so much easier to move around . I would stay here again 100%",5
"On a solo weekend trip (and as a former New Yorker who knows NYC fairly well), I chose this hotel for its central location and walkability, cleanliness, safety, and a good night's sleep. It's in an excellent location right by the Times Square train station with access to a million lines to take you anywhere, a quick walk to/from Penn Station train station (as I'd be taking the NJ Transit from Newark airport), and a quick walk to Broadway shows and many key NYC sites like Empire, Rockefeller, Bryant Park, etc. As it's in a central busy location with Times Square's constant bright lights, I always felt safe walking back by myself even at 2am. There is always a security guard at the front door too. This is a no frills not super fancy place, but is excellent for a reliable clean room, unbeatable location, safe area for solo traveler, and quiet sleep. Lobby staff were great and friendly. You're paying for location here to maximize time spent out in NYC, not a luxurious hotel stay.",4
We enjoyed our stay! This was a great hotel room. The room was small but not abnormal for hotels in the area. This was a good home away from home. I would stay here again.,5
